{
  "version": "1.0",
  "title": "HOLLYWOOD ACTORS BOX OFFICE",
  "subtitle": "EARNINGS OVER TIME",
  "entities": [
    "Adventure, Drama, Science Fiction",
    "Action, Adventure, Comedy",
    "Crime, Thriller, Drama"
  ],
  "assets": [],
  "layout": "ranking",
  "backgroundColor": "#ffffff",
  "accentColor": "#e11d2e"
}